<?xml version="1.0" encoding="UTF-8"?>
<!DOCTYPE bild SYSTEM "kundenliste.dtd">
<kundenliste>
		<Kunde>
			<name>Baxter</name>
			<Straße>Kantstraße</Straße>
			<Hausnummer>2</Hausnummer>
			<PLZ>33790</PLZ>
			<Ort>Halle</Ort>
			<Ansprechpartnerliste anzahl="1">
				<Ansprechpartner>
					<name>Muster</name>
					<vorname>Peter</vorname>
					<position>Abteilungsleiter Entwicklung</position>
					<Telefonnummer>01645863138546</Telefonnummer>	
				</Ansprechpartner>			
			</Ansprechpartnerliste>
			<Betreuer>
				<name>Peters</name>
				<vorname>Hans</vorname>
			</Betreuer>
			<Bemerkung></Bemerkung>
		</Kunde>
		<Kunde>
			<name>Baxter</name>
			<Straße>Kantstraße</Straße>
			<Hausnummer>2</Hausnummer>
			<PLZ>33790</PLZ>
			<Ort>Halle</Ort>
			<Ansprechpartnerliste anzahl="1">
				<Ansprechpartner>
					<name>Muster</name>
					<vorname>Peter</vorname>
					<position>Abteilungsleiter Entwicklung</position>
					<Telefonnummer>01645863138546</Telefonnummer>	
				</Ansprechpartner>			
			</Ansprechpartnerliste>
			<Betreuer>
				<name>Peters</name>
				<vorname>Hans</vorname>
			</Betreuer>
			<Bemerkung></Bemerkung>
		</Kunde>	
</kundenliste>